{
  "schema_version": "0.2.0",
  "claim_id": "01JAX7Q0VN4Z3K9F2M8R6T1C5D",
  "input_revision": 2,
  "job_key": "01JAX7Q0VN4Z3K9F2M8R6T1C5D:2:consolidate:all:41c8ba07",
  "versions": {
    "rules_config": "rules-1.0.0",
    "cost_table": "costs-2026.09.1",
    "taxonomy": "parts-1.0.0",
    "code": "0.2.0"
  },
  "provenance": {
    "source_kind": "real",
    "runtime_profile": "full",
    "producer_service": "cmev-consolidator"
  },
  "occurred_at": "2026-09-22T03:41:05Z",
  "dedup_key": "43f0b91b56da3fbea2e9652a208f6e9294677690b4242d01dd73e3273360577a",
  "trace_id": "9d1f0c2a7b3e4f58",
  "causation_id": "d81b5e07f3a92c64b0d2f4a6c8e0125793bdf5a7c9e1b3d5f7092a4c6e80b1d3",
  "assessment_revision": 2,
  "payload": {
    "assessment_revision": 2,
    "assessment_state": "ready",
    "finding_counts": {
      "ok": 1,
      "unsupported": 0,
      "cost_outlier": 0,
      "insufficient_evidence": 1,
      "excluded": 1
    },
    "proposed_addition_count": 0,
    "suppressed_addition_count": 0,
    "cost_checks": {
      "within_range": 1,
      "outside_range": 0,
      "insufficient_support": 0,
      "not_evaluated": 2
    },
    "pinned_versions": {
      "parts_model": "parts-segformer-b0/1.2.0",
      "damage_model": "damage-segformer-b0/0.9.0",
      "penmark_model": "penmarks-frcnn-r50/0.7.0",
      "ocr": "paddleocr/2.7.3",
      "parser_config": "parser-1.0.0",
      "assignment_config": "assign-1.0.0",
      "summary_config": "summary-1.0.0",
      "link_config": "marklink-1.0.0",
      "taxonomy_parts": "parts-1.0.0",
      "taxonomy_damage": "damage-cardd-1.0.0"
    },
    "incomplete_reasons": []
  }
}
