{
  "schema_version": "0.2.0",
  "claim_id": "01JAX7Q0VN4Z3K9F2M8R6T1C5D",
  "input_revision": 2,
  "job_key": "01JAX7Q0VN4Z3K9F2M8R6T1C5D:2:consolidate:all:41c8ba07",
  "versions": {
    "rules_config": "rules-1.0.0",
    "cost_table": "costs-2026.09.1",
    "taxonomy": "parts-1.0.0",
    "code": "0.2.0"
  },
  "provenance": {
    "source_kind": "real",
    "runtime_profile": "full",
    "producer_service": "cmev-api"
  },
  "occurred_at": "2026-09-22T03:41:02Z",
  "dedup_key": "d81b5e07f3a92c64b0d2f4a6c8e0125793bdf5a7c9e1b3d5f7092a4c6e80b1d3",
  "trace_id": "2ab4e6c8d0f13579",
  "assessment_revision": null,
  "causation_id": "5a91...",
  "payload": {
    "trigger": "reassessment",
    "image_branch_state": "complete",
    "document_branch_state": "complete",
    "summary_ids": [
      "ps_01JAX9B1",
      "ps_01JAX9B2"
    ],
    "coverage_ids": [
      "pc_01JAX9C1",
      "pc_01JAX9C2",
      "pc_01JAX9C3"
    ],
    "line_item_ids": [
      "li_01JAX9T1A",
      "li_01JAX9T1B",
      "li_01JAX9T1C"
    ],
    "mark_ids": [
      "pm_01JAXA01",
      "pm_01JAXA02"
    ],
    "review_revision": 3,
    "cost_table_version": "costs-2026.09.1",
    "rules_config_version": "rules-1.0.0",
    "pinned_versions": {
      "parts_model": "parts-segformer-b0/1.2.0",
      "damage_model": "damage-segformer-b0/0.9.0",
      "penmark_model": "penmarks-frcnn-r50/0.7.0",
      "ocr": "paddleocr/2.7.3",
      "parser_config": "parser-1.0.0",
      "assignment_config": "assign-1.0.0",
      "summary_config": "summary-1.0.0",
      "link_config": "marklink-1.0.0",
      "taxonomy_parts": "parts-1.0.0",
      "taxonomy_damage": "damage-cardd-1.0.0"
    },
    "reason": "review_action:confirm_price_change:pm_01JAXA02"
  }
}
